{
 "id": "edc65867-3d8d-48e0-81cb-1d68f4a68c5c",
 "publication": "Morning Edition",
 "city": "Bengaluru",
 "date": 809921803.227334,
 "sections": [
  {
   "id": "14a98d2b-dd68-41c3-aa75-4fbde04fb4a1",
   "title": "Front Page",
   "stories": [
    {
     "id": "7c3444c7-190b-4165-82f1-225b772b3210",
     "category": "WORLD",
     "headline": "Nepal flash floods aftermath LIVE: Nepal PM demands int'l climate action in wake of disaster",
     "deck": "The number of Indian nationals rescued in the wake of the devastating flash floods stands at 158, according to the MEA",
     "byline": "The Hindu",
     "visual": {
      "type": "none"
     },
     "blockType": "hero",
     "bodyText": "Nepali Prime Minister Balendra Shah said last week’s deadly Himalayan flood was “not an ordinary” event but driven by climate change, as he demanded international action.\nCatastrophic flooding along the Nepal-China border has killed hundreds and left thousands more missing. Rescuers in Nepal are racing to free hundreds of workers thought to be trapped in hydropower site tunnels that were buried in mud.\nALSO READ | Nepal disaster, a grim reminder to rethink preparedness | Data\nThe number of Indian nationals rescued in the wake of the devastating flash floods stands at 158, the Ministry of External Affairs said, as India stepped up its relief and rescue efforts in coordination with Nepalese authorities.\nFollow latest updates here:",
     "articleURL": "https://www.thehindu.com/news/international/nepal-flash-floods-live-updates-death-toll-persons-missing-rescue-relief-september-1-2026/article71413472.ece",
     "pubDate": 809921552.0
    },
    {
     "id": "f254d9fe-8df8-4c19-89f7-f3f415284291",
     "category": "WORLD",
     "headline": "Woman randomly stabs 2 people in New York City’s Times Square, shot by police",
     "deck": "Police reportedly do not believe the stabbing was terror-related.",
     "byline": "The Hindu",
     "visual": {
      "type": "remoteImage",
      "url": "https://th-i.thgim.com/public/incoming/7fvzto/article71413474.ece/alternates/LANDSCAPE_1200/2026-09-01T005158Z_180058590_RC2Z9NALPOMN_RTRMADP_3_USA-SHOOTING-NEW-YORK.JPG"
     },
     "blockType": "feature",
     "bodyText": "A knife-wielding woman stabbed and killed a person and injured another in New York's tourist-filled Times Square on Monday (August 31, 2026), before she was shot and killed by police.\nMayor Zohran Mamdani announced the deaths in a press conference, saying that the second victim was in stable condition in a hospital.\nLocal news reports said the suspect was taken to hospital in critical condition.\nPolice reportedly do not believe the stabbing was terror-related.\nAn AFP journalist at the scene saw a large emergency services presence and officials inspecting a patch of blood in Times Square, a typically bustling hotspot for tourists.\nOne witness told local outlet PIX11 that the suspect had two knives in her hands and was tased by police before she rushed at officers.\n\"They shot her twice,\" said the unnamed witness.\nThe New York Police Department described the incident as a \"confirmed officer-involved shooting.\"\n\"Right now, it's still an active and ongoing investigation,\" a spokeswoman told AFP at the time.\nPublished - September 01, 2026 07:32 am IST",
     "articleURL": "https://www.thehindu.com/news/international/woman-stabs-two-times-square-new-york-usa/article71413469.ece",
     "pubDate": 809921078.0
    },
    {
     "id": "f7914c61-f315-4d64-863f-81fceee3d465",
     "category": "NATIONAL",
     "headline": "'A particular issue': Penguin India on impasse over Sonia Gandhi memoir",
     "deck": "Penguin Random House India has decided to pause the publication of Sonia Gandhi's memoir, citing an editorial disagreement. The publisher clarifies that this choice was not influenced by outside pressure but rather emerged from routine editorial evaluations. During the review process, some proposed changes were accepted while others were not. In the end, an unresolved issue led to the book's…",
     "byline": "Times of India",
     "visual": {
      "type": "remoteImage",
      "url": "https://static.toiimg.com/photo/msid-133665975,imgsize-67546.cms"
     },
     "blockType": "feature",
     "bodyText": "NEW DELHI: Penguin Random House India on Monday said publication of Sonia Gandhi’s memoir in India had stalled after the publisher and the author’s representatives reached an “impasse over a particular issue.” The publisher also firmly denied that any external pressure had influenced the decision.\nPenguin India said the disagreement emerged during its normal editorial review of Belonging: A Journey of Love, which it had been keen to publish.\nThe clarification came amid a growing political controversy over the memoir’s India publication, after Alfred A Knopf, the US-based imprint of Penguin Random House, announced that the book would be released worldwide on November 10. While Congress leaders have raised questions about possible governmental pressure and freedom of expression, Penguin India said the disagreement was strictly part of the editorial process.\n“On some, they agreed to changes and on others, we accepted the author’s position. Unfortunately, and ultimately, an understanding could not be reached on a particular issue,” the publisher said.\nPRHI spokesperson Pallavi Narayan said the publishing house had been “really keen” to bring out the memoir, describing it as “a hard-won acquisition”.\n“We feel it is important for us to correct certain misrepresentations regarding the forthcoming memoir 'Belonging'. This is a book that we at Penguin Random House India, were really keen on publishing as it was a hard-won acquisition,” Narayan said in an exclusive statement to PTI.\nThe publisher said the manuscript had gone through its “normal editorial process”, during which several points were raised and discussed with the author’s representatives. Some proposed changes were accepted, while on other matters Penguin India accepted the author’s position.\nIt was ultimately the unresolved issue that brought the publication process to a halt, according to PRHI. The author’s team subsequently informed the publisher that they did not wish to proceed with the publication, a decision the publishing house said it respected.\nAt the same time, Penguin India rejected suggestions that the impasse was the result of intervention from outside the publishing process.\n“Since the content of the book is confidential and under embargo, there was no external pressure whatsoever,” the publisher said.\nPRHI declined to reveal the nature of the disputed issue, citing its contractual obligations and commitment to author confidentiality.\n“Since we are bound by an agreement, and author confidentiality is paramount to us, we will not divulge details of what led to the impasse,” the publisher said.\nThe publishing house also defended its decision to scrutinise the manuscript, saying editorial assessment, questioning, fact-checking and recommendations were part of its responsibility as a publisher.\n“As publishers, it was its “responsibility and duty” to critically assess a manuscript, ask questions, make recommendations and exercise its independent editorial judgement,” Penguin India said.\nThe controversy intensified after reports that Penguin India had backed out of publishing the memoir following disagreements over editorial changes. Former Rajasthan chief minister Ashok Gehlot alleged that pressure had been put on Penguin India to remove sections concerning Prime Minister Narendra Modi, the RSS and China’s occupation of Indian territory during the Modi government.\nShare your thoughts in the comments\nBe respectful · TOI community guidelines\nFormer Madhya Pradesh chief minister Kamal Nath also questioned whether the publisher’s position had been influenced by pressure from elsewhere.\nPenguin India’s latest statement, however, maintains that no such external intervention took place and that the disagreement arose solely during the editorial process.\nThe memoir is expected to offer a rare account of Gandhi’s life, covering her childhood in post-war Italy, her marriage into the Nehru-Gandhi family, the assassination of her husband and former prime minister Rajiv Gandhi, and her subsequent entry into politics.\nWhile the international edition is scheduled for release on November 10, the status of its publication in India remains unresolved.",
     "articleURL": "https://timesofindia.indiatimes.com/india/a-particular-issue-penguin-india-on-impasse-over-sonia-gandhi-memoir/articleshow/133665902.cms",
     "pubDate": 809920809.0
    },
    {
     "id": "a433b017-0c46-4e17-96aa-c244c916c298",
     "category": "HEADLINES",
     "headline": "Google renames Lake Ontario ‘Lake America’ in US; what others will see",
     "deck": "In a bold move, President Trump has rebranded Lake Ontario as Lake America during ongoing trade conflicts. This shift is now reflected on Google Maps for American users, while international observers will encounter alternative names. Apple's mapping services have also adopted this change, prompting a response from the Canadian Prime Minister, who emphasized the historical significance of the…",
     "byline": "Times of India",
     "visual": {
      "type": "remoteImage",
      "url": "https://static.toiimg.com/photo/msid-133665917,imgsize-29467.cms"
     },
     "blockType": "standard",